{
  "target": { "status": "valid" },
  "non_tradable_constraints": { "satisfied": true },
  "baseline_upper_envelope": { "status": "valid" },
  "capability_process": { "status": "valid" },
  "viability_control": { "status": "valid" },
  "raw_net_capital": { "lower_bound": 4.5 },
  "time_to_target": { "acceleration_lower_bound": 12.0 },
  "stopping_conditions": { "status": "valid" }
}
